[
{"sponsor_id":"spon-01","business_name":"Pacific Crest Home Lending","headline":"Reliable residential mortgage solutions with low rates across Greater Los Angeles.","cta_text":"Get Pre-Approved","target_url":"https://www.pacificcrestlending.example.com","logo_url":"https://cdn.example.com/logos/pacific-crest-lending.png","logo_alt":"A modern navy and gold logo depicting a house silhouette integrated into a mountain ridge."},
{"sponsor_id":"spon-02","business_name":"Angel City Property Inspections","headline":"Thorough residential inspections and comprehensive same-day digital reports for LA buyers.","cta_text":"Schedule Inspection","target_url":"https://www.angelcityinspections.example.com","logo_url":"https://cdn.example.com/logos/angel-city-inspections.png","logo_alt":"A green shield insignia displaying a magnifying glass over an architectural roofline."}
]
